text_preprocessed,label,len
хто перш людейгандон ад бо йог жінк перш бабагандон,1,9
у двер подзвонил і лєр в трус пішл відкрив лєр дурн,0,11
так я в скайп підписан пушистік так мен 10 так можн ржатиз,0,12
не крич ал крєпк сумнів зовс не прот що вияв не прав,0,12
що кращ наш міськрад зробил з міст гівнотвіт,1,8
ахуєваюч себ почувал прост худоб без ніяк вмінн інтелект,1,9
том на пар у мен лиц страждальц зат як непохитн,0,10
відшука злоїбуч жінк і посад в кулон получиш перфектн подарунок твоє дружин,1,12
ден поч з жашк ід наху дім зєб звід і заберіт свог далбайоб мен діст,1,15
уж понад півтор місяц риг катаєт машин з од аж хочет підійт спит що тут забув підарас,1,17
що йобл тут займают це діяльніст як називают житт,1,9
а це момент вибач не подум,0,6
куд приткнут на подол барчик що так,0,7
якщ не знаєш що робит прост заїбавш,1,7
прост тут виникл суперечк і я в упор не мож уявит можн вчин поінакш,0,14
виїб педосівськ це дешевш ніж придб більш автобус,1,8
до пят тре випрасув ще 20 чохл скажен темп уж попекл пальц,0,12
у мен тільк 2 настр 1 ід наху уйобок 2 ід наху уйобок мі 3,1,15
звичайн що шлюх кращ дружин ж не потрібн задовільн,1,9
хто зна подивит список друз вконтакт якщ вон закрит,0,9
лох а стерв ну соб комплімент зрозм то люб,1,9
один мі знайом каз що посварит з людин можн тільк якщ мудак,1,12
в інш вух я каж не треб огидн,0,8
вед себ мудак і не рад житт,1,7
кол можливіст трахнут не трах кол нем ни шо хоч секс їбанут баб блят,1,14
спікер робит селф в готел і неха світ зачек,0,9
а час летит шлюх з девят поверх,1,7
що дарм каж педосівчанин до свог друг це теб брат бо мен не достатн педос,1,15
у патріблєн нем мозк,1,4
що за хлопчик ма найдовш подпізджік невідомец,1,7
мож своїх фоток з гір поскид нагнітанн атмосфео,0,8
в топ на укрбаш псевдоцитат табачник ї бож я гад шо всі вже в курс,0,15
знаєш це так дивн бо якщ дівчин ма багат чоловік то шлюх а якщ хлопец то самец крут респект,1,19
що якщ всі паср бездомн ніхт не зміг працюв,1,9
ця іспанськ пісн застрял в гол і на повтор ціл ден я і слов не розумію…,0,16
виходит що сторіс наш маленьк таун дивл більш ніж антверпен,0,10
аб деревян хатинк на полтв як потон якщ хто важит 66 кг,0,12
якщ зайобув то можеш вже піт до дом,1,8
ну то пизду вчит коал підвид львівськ,1,7
сам на свят відчуваєш себ одинок том і ненавидиш,0,9
підарас підарас,1,2
нитик і уйобок забира з мог житт на що це натякаєш,1,11
аж цікав скільк дійсн люд тоб говорил в лиц що мудак,1,11
що залишил післ тог педорос випил всю лікарн абсолютн ніч,1,10
у курвастар нем мозк бо витрат йог на алкогол,1,9
ахуєнськ чоловік це кол приходит дод і йог жінк не ах,1,11
знов на тем львівськ карпат вчерг горд чимчикуюч з цигарочк повз стадіон україн проходж кріз групк підлітк кра вух чу підарас і смішк пот оцінюют мен ззад схожийсхож аж настр підняв треб буд провест виховн бесід підмін пон,1,38
канал не буд а прост картинк щодн ділит мож,0,9
пиш можн знім нов серіал я проїб ваш мам бо я туп мудак,1,13
дм то як занадт інтимн не можн ж взят і отак людин рапт в дм напис,0,16
забебал і не знаєш що так мов,1,7
гот до двох надважк розм змінит і не каж що не попередж,0,12
що тут пояснюв прост жал на житт і на себ,0,10
запитайт в мен що адекватн в четверправд,0,7
похєрачил потрапил до психушк,1,4
71 2009 акающ мразот приїздит з одн місц в світ мацквабад,1,11
добр ранк з ліжечк файн понеділк,0,6
я вот недавн згад кол всот побач тих анфоловер,0,9
підзаєбал завданн ал не стал подив бо ж подзаєбал,1,9
що не волонтьор – лідєр мнєн то брехлив прорусняв мразот що пиздит грош люд і налив прорусняв риторик жизн,1,19
бит так вчител треб я спортзал довг боял і сторон обходил,0,11
концерт в підтримк кличк пфф форум видавц,0,7
показ періодичн пожен аб всяк жах російськ глибинк,0,8
всьо це момент наст нат завел інстагр,0,7
пха поган знаєш якщ я відвез а не навпак то буд ще гірш,0,13
а ріл чо вон лізут кол чмо серед бомж а кол звєзд то пофіг,1,14
прабаб прислужувал як єврейц давал ї їж і так чин вон змогл вижит,0,13
а з чим вареничк з висок глікемічн індекс,0,8
постійн подертірозбит колін шлюхаподумаєт любл фотографуватискаж я7,1,7
виявляєт мо састаян атсутств шо супроводж мен останн дні це ефект таблеток як зараз прийм ше алкогол не можн а я вчор навалил скотин ну піздєц,1,26
клас шкод що цьог рок хепібьозд не заспіваєш гарн подорожж,0,10
ну шофотк обробил тепер треб що шкрябнут ал емоц нул,0,10
що я зна як одн людин мудак ал нік не каж робит мен безмежн благородн прост мен ніхт не повірит,1,20
напіздув бабус на диван це відмінн спосіб зробит дуж нещасн,1,10
вірш запиш на днях бо сьогодн трішк не в том стан тог,0,12
що зробит якщ тво дитинств так поган що зайобуйт не можн,1,11
мо єдінствінн грамот з прав в тумбочц валяєт,0,8
обйобан жінк найкращ почуваєт кол прикривают два кульк картопл,1,9
їдем в пуст трамва персональн,0,5
ті хто похуєв не мают дум,1,6
якб юл не в качанівц не майдан бо народ нестерп просивюл вол,0,12
слов на с там займают спорт сект,0,7
буд сам по хат ходит пок ніхт не бачит,0,9
ком радіоафродіт емпетришн формат мен влом в лузлесс тойв,0,9
піш у дуп одн ніч не хочеш робит,1,8
гад бєр шьінєл пизду в растов6,1,6
вйобув у психологі ал йог результ так жахлив що пройш за перш раз і нікол більш не повернув,1,18
реч котр це вже занадт наприклад віктр павлік,0,8
знов наш відд стар форм молдаван,0,6
о підар,1,2
відбуваєт конкурс на найпиздатіш чоловік і перемог вигр президент,1,9
в цьом роц крім мам і баб нік особист не привіт з 8мим березн самозакохан мудак,1,16
одн телефонн розм знов зіпсувал,0,5
не зна жодн жив людин як вон стрес знімают,0,9
що обсир більш всьог при дівчат іх розумінн,1,8
ки це то мудак що прстійн крад у мен гарн дівчат і перетворю на втомлен житт створін ми з ним конкурент,1,21
теж домовлял інакш далек ми не заїх,0,7
піш наху це єдин нормальн діалог з так по діл що напис ніх що балак,1,15
же мен бісит кол хто почин повідомленн привіт блят йди наху,1,11
в так вечор хочет сидіт на берез мор з пляшк вин і обійм дівч,0,14
бабц неймовірн любл,0,3
пересреверт вибач я думал шо лох післ баталіст ал територ команч прост інверт ма,1,14
бляд не знаєш ніч прост дурен,1,6
що відбуваєт кол два гімноїдств друж вон прост хвилюют з гордіст,1,11
підтримк сім далбайоб їбанат дебіл йобнут,1,6
зрозуміл щоб зіскочит з газов контракт тамошенк за виконанн котр топір маст гівн порох цит нужн прост прізн вайн вайн с зрадойобськ виблядок отак прост і залишит сам на сам з русне бо ху хто впряг у прям і відкрит протистоянн,1,41
так слабеньк мереж хоч раз твітнут,0,6
кароуч дум номінац мудак рок я візьм,1,7
нєєбацц і безбачн люд найкращ що мож на світ,1,9
ржу мудак з пост груп че,1,6
це припіздал планетарн лідер не зна правильн працюв,1,8
народ а приймаєт біологічн добавк щоб прибавит силушк,0,8
том не вбач в нр чог сакральн не мож сказ різдв,0,11
у плоскоморд приятел нем друз бо всі бо йог плоск посмішк,1,11
нє каз багат що сам говорит за себ,0,8
що за прифіг так займ секс з ваш батьк,1,9
якщ запердоляєт доступ до свог дом знайт що не запердоляєт доступ до свог розум,1,14
кожн баб ма у соб неймовірн мудріст досвід,0,8
назв гер гречеськ богин хіб не крут,0,7
а я справжн закул подумал в забігайлівц ті в дєцтв з бабун,0,12
укртв мал сел всі знают хто мудак і хто ког їб ц 1711,1,13
бля що це за набєг учітілє жизн я в курс пацан прікіньт,0,12
йобтваюм дівчат брат багат грош хлопц щоб вон задоволен,1,9
ну чом зовс нє то ал теж варт перегляд,0,9
що за виєбєньмазг так люд робл вон прост виєбєньмазгуют,1,9
підар ол хєр пох пат,1,5
скажеш шоб відійшл на пар метр дальш,0,7
оц взагаліт я нещодавн стеж за твоїм твіт не знав фотограф,0,11
що правит в україн оккупайобід,1,5
я взагал не засн якщ двер відчинен вікн не зашторен,0,10
я володінн давн китайськ мистецтв між інш,0,7
всім дяк ідіт наху,1,4
що там не бач твіт профіл під замочк,0,8
сподів всі мраз росіян здохнут у пакет поїдут дод,1,9
о дяк то кажеш якш робит правильн не течут,0,9
так блят мо вмінн видалит і невчасн згад сказал мен ід наху,1,12
кум замов наліпк на машин трамп чмо бізнесмен тонк відчув тренд,0,11
держ перфекціонізм себ а тво лиц до зерн кукуруз,1,9
зна прост дуж не приємн я не чекал так реч людин як поважал,0,13
мен запропонувал поділит і я ну ок,0,7
щоб вийобув з житт треб трох пянк і дуж багат грош,1,11
вов ід наху до вов ми теб люб лиш за приходьт до мен ввечер будем шашлик робит,1,17
якщ теж йобнут то велк до сект тих хто мрі какт ча зі смак шампун,1,15
і ще на люкс працюв і гендел ма,0,8
взгляд цьог кот прям говорит шо єбанут пизду спать532,1,9
чуств себ лох кол втик ціл ден вдом а гол то помит,1,12
чот мен сикотн а поїд дал по кол бо нє то дуж і дуж поган,0,15
що робит зажопінськ дівчин кол ї поган прост їст сво проблем,1,11
не хотіл сьогодн пит ал пю оц так сил вол,0,10
і наскільк це част малореальн і дор в українськ реалі,0,10
мож я прост вигляд мудак а не том що я сидж в маршрутц,1,13
дума продуктивн що я робл не так хто тут накосяч спроб інш варіант на ког скинут це гімн можн зробит кращ нах взагал стар треб рост дал ха їбет кон це займ час одраз наху на помилк вчат я не помиля підар,1,42
натрах хлопц в ці кімнат,1,5
що надрочуєш мен на проблем не знаєш вирішув,1,8
нормальн цін електронн книг,0,4
якщ зайобітк буд дивит в телебаченн то буд бачит тільк поган новин,1,12
що зробит якщ тво охтижйоптв забул ден народженн твог друг прост прин йом пакет з паперосмітт прийнятн,1,17
шо то за тєм з адвенткалєндар всьо ріш в майбутн роц,0,11
якщ жив виблядок,1,3
вищіпув бров щоб пот соб намалюв,0,6
на вулиц ста спекотн на моєм термометр 28,0,8
хто тільк з ліжечк вилазит а я вже їдус,0,9
привід тільк теб бо підор більш нік,0,7
я тут соб атлічн відсип а як мудак прийш показник вод знім в субот зранк,1,15
фраз дня я слішк стар ет дєрьм,0,7
це вазонокулярисклянк молок і коротк чорн зачіскавон вічн,0,8
що вїбут мур по дороз до казин аб вон вїбут на щаст,1,12
аб борщ ал в пікас дуж смачн борщ,0,8
післ мюнхен мен прост не хочет дивит на люд в метр,0,11
якщ пососит парус то пососеш успіх,1,6
шкод я дум мен лікуванн призначиш,0,6
наїбенил так дівчинк по улиц що даж відхилил маривон,1,9
я бач палиш мен оч в теб гарн с,0,9
напиздиш своєм батьк,1,3
якщ взїбл до трет курс значит не знаєт ніч,1,9
що за блятьсук так причесал щоб ніхт не зрозум що це блятьсук,1,12
кажды суслик в сво пол агрон головн аргумент етнополічн дискурс на пар,0,12
що робит ахуєнчік післ тог заплат за просмотр непристойн фільм йде дод і ділит своє ахуєнчікіст з друз,1,18
не кусайт льодик якщ в чутлив зуб нікол,0,8
ну тепер і в о буд їх мокріньк кісаньк,0,9
дореч в асьц я з твітерян спілк,0,7
ну в мен так з дитинств прокид і чог трашн і ненач хто що поруч,0,15
чим більш це лайкаєт тим більш хоч,0,7
дівчат допомогл приготув торт на ден народженн,0,7
кол баб смієт ус відчувают себ кращ,0,7
я показ ал я не так як трєзв,0,8
о таааак у мен це віде кол півдн на повтор це чистісіньк маг,0,13
а может не торкаюч колін рахув пульс а я мож,0,10
найгірш що можн почут інженер то лінійк слабак слав автокад,0,10
українськ тижден бютнут на всю голов,0,6
ніхуйн будеш повніст залиш незадоволен якщ не купиш соб це продукт,1,11
і я не думал що написал з посил нащ пишеш бо тод я огризнул,0,14
що педосянин зроб кол йом потрібн попросит дівчин дат постав ї питанн хочеш спілкув з педосянин,1,16
жінк мают велик терпінн як допомож в будьяк ситуаці,0,9
блят я істинн лох я проснул на перш пар і тут бач що странн н не ставл до чорт це,1,20
ще трох і зможеш замутит соб що бо не ж слідуватимеш настанов мам,0,13
хто вже вид інтернат у львов ні,0,7
у нас 37 по гривн це вже сприймаєт давньотраянськ легенд,0,10
власниц моє кв настільк їбанут що без попередженн прийшл щойн мовляв загубил мі номер а я настільк туп шо відкрил ї,1,21
це мудак змуш мен плак а я за ним біг я баб я туп,1,14
нуууякщ в мен буд бірюз з сердечкамит хлопц з кімн не зрозуміют,0,12
що діл отгандон в кабінет директор завадит йом насолод,1,9
о мат на тижн гост і з тернопол і з харк,0,11
що афігенськ ма хазяїн бар заборон відвідув йог жінк,1,9
а о так назив мен чмо підар хуйл їблан дувбойоб придурок дурак ідіотін і не перечислиш,1,16
о один наїбнут жарт чом жінк не можут пілот бо вон прос швидкост наїбнут,1,14
що зроб жопопляс кол почув вибор поїх голосув з карт банк паспорт,1,12
припіздит баб з магазин,1,4
де у львов можн купит смачн булочк бутер,0,8
медичн робот допомогл дівчин вилікув тяжк хвороб,0,7
якщ шлюх тоб гот то це вже дружин с,1,9
5мал з брат спільн план брат напис що підем завтр,0,10
блят заїб оберт на мен в маршрутц мо вух мо булет ідіт наху,1,13
11 а на наш проект теор що до клієнт будут дзвонит і післ їхн смерт,0,15
я пізн дод прийшл і мен лін ал практик так,0,10
якщ у зйоб бабк то не працюв на простор прогулянок,1,10
сір лох якійт,1,3
з нас двох красив а я мудак,1,7
жінк – це велик розумник як здатн розуміт прийн правильн рішенн,0,11
що робит засир на корабл працю на корм щоб не дістав чорн,1,12
медсестр допомогл дівчин прийн відповідн лік,0,6
посрализїл так що мо невагом жарт здав потрібн терапі,1,9
о клас в мен вся стрічк істаграм в так а цьог не знал,0,13
жінк як працюют у додают сві внесок до розвитк технолог,0,10
нє я не дуж по фільм ал з опис що в вічц то не дуж подібн істор,0,17
бож так приємн то чит зазвича я на віде не дуж,0,11
і прав розказ мен я мудак знаходит поряд з моїм прав посл післ цьог під три чорт вдал робоч тижн,1,20
мудн чоловік прост прагн знов дитин щоб йом не потрібн витрач грош на подарунк друз родин,1,16
можеш не сильн стар я сам тістечк,0,7
шкод що я трошк в том лох с,1,8
тут написан церковн школ а я чит церковн шлюх я скаж спасіб шо не церковн першокурсниц,1,16
досвід робот менеджмент гурт — нє мен себ поменеджменит,0,9
дітермінован операц допомогл дівчин вилікув,0,5
що за пизданин так привітал на робот прийнят на пиздан,1,10
ойблятьап настільк дурн що йог підходил лиш парті платон,1,9
ахрєнєзн що деяк люд не можут прийн так їхн єств,1,10
дуж туд хоч ал скоротил бюджетн місц і я проліт,0,10
термальн вод в спре так ціл,0,6
не общітєльн шлюх,1,3
навіщ їх туд де теб ніхт не чек,0,8
в буд як раз – з бомж зняв а якщ ще за грош – то лох бгг сумн жиз,1,19
якщ встат піт галюцинаці посилюют політ йобнут хюстон,1,8
це припізднув чоловік не зна що так досконал люб,1,9
так як в приклад ставил я першачк збир,0,8
інод мен здаєт шо люд не бач прихован йди наху сенс в моїх слов,1,14
ну в офіс зяв друг і антагоніст як брак в постмодерн,0,11
блін взагал йобнут мікстейп вийш,1,5
дівчинк вже хвилин з 40масаж мен робит,0,7
не шлюх а свєтск львіц,1,5
правильн розбудован маркетинг стратег рєшаєт всьо,0,6
спасіб рутрекер шо на тоб всі випуск киевск старин 1882 рок,0,11
готуєм вечер і говорим числ фібонач і їхн експоненціальн ріст,0,10
но от шведськосімейств мен нерв ну зоч,0,7
ок а що ще тод бо тог хватит на пар мб віде ж на пар сек,0,16
збереш діт аб допоможеш в цьом квитк я знайд наріш,0,10
хто зна що за шлюх кароч шлюха7,1,7
непроїб ціє кімн,1,3
сьогодн ріл шпійон ід на вокзал забир ячєйк камер схов товар,0,11
на жал ні післ ремонт хоч піт на кур бо сам як не йде,0,14
