text_preprocessed,label,len
шо куд не покл знайдет мудак переклад то ху зна куд,1,11
з мексиканц у кут спілкуют англійськ з українц німецьк,0,9
людин приречен вільн жанпол сартр,0,5
ан дівчат розкажіт мен як у епілятор,0,7
це обісрал парен прост не зна поступ,1,7
якщ придб автомобіл а працю не так повинен не виникайт ваш жидофашизм не працю,1,14
ну не акцентуют вон ж не кажут сук підарас перевіта прост так виходит,1,13
нє шоб один цельн твіт напис пиш по пар штук на одн тем,0,13
лайн компан вже звільня них,1,5
я найлоховіш лох всі твітор не знав,1,7
засцит парус а пот пішл зайн україн,1,7
принест бухл відкрит і налит в бокал цьог буд досит,0,10
єдин корист як я мал мужик за останн кільк місяц,0,10
діснейленд це місц де не знаєш упор дійсн з кущ музик гра,0,12
психолог вправил мен мізк надовг,0,5
сказ мудак що мудак так всі оч в підлог опускают,1,10
о так і це до реч явн і кричущ пробіл у статт,0,12
якщ діт надрочуют занадт багат батьк потрібн буд под їм на прийманн психотерапевт,1,13
житт чекаєш пок тоб відчин двер тамвиявляєтьсяпуст,0,7
у охуенен нем мозк,1,4
ідіт наху з своїм всєм доступн мєтодам сам не розумієт що несет хрипл кричит сук невж не досит цьог гівн за крєпк хазяйствєннік не наїл бляд це важк баж нікол не потрапит під роздач всєм доступньім щир,1,37
що зробит якщ придовбух вип на дорог почек пок йог перестают прокатув,1,12
що виклик найбільш сміх в обсиральник прий нов пацієнт,1,9
чом я кол це уявля то дівчин на тво фот в одн сорочц,0,13
ну медбрат там тож один відносн сєкас,0,7
що за гімнастик якщ гімн на постіл тод ми могл назв це гімнавлянн,1,13
мам у мен гол болит о ж мо бідненьк пизду на навчанн,1,12
карєр робит карєрист а справжн митец робит карєр ніб мимохід цитатадн,0,11
пізданіт мен по гол і вибийт всю цю дур,0,9
обісцял дитин настільк глуп що не зна що так алфавіт,1,10
а вже зранк чом збир докуп йог уламк,0,8
знайт бода як раціональн причин чом мен не спит крім то що я лох я не спроможн,1,17
жінк ма мат прав на рівніст з мужчин,0,8
зроб соб порад і відвіда ніфігашечк,1,6
виклика прес щоб підібр соб друг,1,6
в мен ще нош в задн карман шнурочєк протер вже,0,10
бодр бодр наш я не мож уявит інакш,0,8
ну дімк ну чо лох,1,5
поліщук попередник прибр ща принциповіст в ціє ніч нем ні совіст ні чест шльондр,1,14
багат нат твітер шоб говорит до себ не тільк усн а письмов,0,12
що більш виєбон в україн ніч бо вон всі вибр з країн,1,12
щойн провел найкращ подруг на автобус до німеччин надовг мен дуж сумн,0,12
мен нудн знайшл у вк груп з анекдот кращ я взагал ніч не шукал,0,14
ми запізнил до закритт магазин на 6 хвилин і на останн екскурс в катакомб на 10,0,16
ког там зачепил мо твіт по вакарчук в як це не тво війн ра прост відст сво інтер спричинил війн і дал по текст а не зачепил ус кра перерахован повідомля ідіт наху відписуйт і не лізьт у мо стрічк однаков нагод ху,1,43
всьопіздєц бо ніхт не захоч з тоб побачит,1,8
можн мен кремуют зараз ал це тип на ден смерт,0,10
не дуж класнокол допрацьовуєш останн дні на робот нов так і не знайш,0,13
я зрозум ал недіабетик тод їд кетчуп,0,7
а йдіт наху з ваш шерлок блят,1,7
кол ніхт не бачит я флірт росс геллер і кол бач то на жал теж,0,15
оговесн значит дивно я тут позначенийц що як натяк,0,9
що зробит якщ довбойб вийшл заміж посл на двох на одн поруч,1,12
якщ мордокнижечц вміл говорит вон виявил найбільш плут у міст,1,10
роб сам бо справд тямит в сво робот,0,8
прожит місяц без тві цілк реальн без напряг,0,8
в мен шок мабут відчувал бо дуж не хотіл стрічк зранк чит євромайдан,0,13
що робит жінк кол ї заборонен згівнит згівниш,1,8
я о клас нем пар в пятниц поїд ка я дод швидш деканат ргм о знаєт ідіт наху ми тут доставил модул в пятницюзззз,1,24
овердофігіщаєш не знаєш що робит,1,5
так незл завалил бідн тракторец під вікн сильн мучит,0,9
мам каж що то йобнут пес як кол жер чіп не можн бо загриз,1,14
то момент кол контракт підписан а робот одн нем,0,9
хочет простощоб батьк жил кращеот і,0,6
що гівнар ма зробит щоб відірв своє дружин прост залишит з одніє гівнар,1,13
відсосал йог за пят хвилин дійсн хорош,1,7
що робит бляд на пляж закид печіньк до мор,1,9
не тод кол друг ден лед не присмерт робот це не рабств,0,12
як дивн фест купал запросил а що дал не чут ніч,0,11
якщ наябув то лиш ганьб бабус,1,6
звичайн мразот на пошт це що зар мен сам не вистачал,1,11
тільк див шоб мам не подумал шо я хвойд я алкаш а не шльондр,1,14
що зроб жирік кол йог затікл в дощ прихов в пальт і закр на пугач,1,15
заїб тих хто вірит в бог щоб заїб,1,8
я заснул ввечер на кільк годин і тепер лох дум шо то з ‘ їст,1,15
дик відчутт тог що я навязал людин і надоїд,0,9
тво мам так груб що припезд не привяз нік,1,9
мудак перепаркув,1,2
прост здохнеш і не будеш заваж нормальн люд,1,8
чом у львівськ круасан нем доставкибажан в ки,0,8
наху мен впав скотин так,1,5
якраз в пятниц піжамн вечірк,0,5
маєш надт багат час щоб похерит йог,1,7
що за безглуздіст поїх до дач пердатил робит прост на веселк,1,11
« він з росі так йом і треб » йдіт наху з так в ці країн системн вбивают люд з проукраїнськ позиціє і не тільк на війн а вдом в машин під під ‘ їзд всім норм позавчор гонгадз вчор шеремет і окуєв сьогодн бабченк завтр підходит всім,1,48
що каж михуїл кол йог дружин заснул післ співк дощ не заснул зараз михуїл,1,14
почул гомер російськ а пот контрольн мардж ліз і барт тиж тиж тидиж,0,13
нарешт подивил крут постановк ал враженн що не докрутил,0,9
у нас ні гаряч ні холодн вод нем непісятьнекакатьнемит,0,9
суперяк завждикол потрібен другпотрібн порадапоруч нік нем,0,7
мен байдуж скільк в мен фолловер не справжн твіттерськ недотвіттерськ,0,10
велик корпораці це зло я художнік я так віж,0,9
що здаєт найкращ способ вирішит проблем здрисн найкращ спосіб забр з пол зор,1,13
це приклад якб в тві систем ютуб то як це працювал,0,11
що зробил пересрібк кол побачил жінк пішл на пересрібк за грош,1,11
шо я лох останн ром треб общацц,1,7
ми так соб подум і вирішил що хочем побудув соб по пірамід,0,12
заварил свіж ча порожн квартир нікол не навіювал мен снів,0,10
що найбільш різнице між жидопутінськ банкір ваш батьк ваш батьк не вимаг процент за користуванн йог грош,1,17
знаходит щаст в дрібниц що мен ще потрібн,0,8
ізраїл де за розмір львівськ обл ал там напхан 8 млн душ і куч різн суспільств як між соб балакают на рівн привітпокаід наху це світськ жидирилігійн жидичорн жидижидипоселенц ізраїльськ араб палистинськ араб це туп різн світ,1,37
подивил 9 сер і не мож натішит що то виблядок нарешт здох,1,12
якзвичан підарстайл7,1,2
я не ста розумніш і не вчу ніч нов задум і капец засмут,0,13
жінк котр вмі коп у сел всім потрібн,0,8
у кінопанорам йде фільм тон ердманн драмакомед прекрасн,0,8
нормальн занадт мал шоб компенсув решт,0,6
ну ніч добр що я підар,1,6
люд приход в центр в плавк щоб скуп в фонтан пиииздец,0,11
що правит дувбуйоб кол ймовірніст підвест йог до відповідальност за порушенн правопорядк вон прост дувбуют обовязк,1,16
хто не любит кїбін дурн діт,1,6
що ма охуєнніш за відкритт двер до церкв на весілл ну мож тільк відкритт двер до бар післ весілл то буд дійсн охуєнност,1,23
сьогодн мі тот шлюх ід в коротк шорт з гетр посміх всім нафарбован губ і граційн перебир каблучк,1,18
не дивл на що вийобувают з твоїх уст,1,8
каз мі викладач з трудов навчанн в школ харош мисл приходит опосл,0,12
закрийс не хоч я ї ображ гамномік кавалок я голодн скотин і щойн вийш з іспанськ післ інгліш з французьк так шо йди пи курв статт пок ціл,1,28
хоч однокласник одн на мен ал вон теж чуд,0,9
тут кривав буквальн повязан з кров,0,6
як чин збільшуєт кількіст читач якщ ніхт не поин мен чит,0,11
це правд в інаріус гарн прокачан це скіл,0,8
вигрібл дівчин залишил без грош бо всі вон забр родич,1,10
мен одн смішн з тог віртус навалюют вег,0,8
всесвіт да мен сил встигнут що ма встигнут,0,8
не повод себ шльондр то бридк,1,6
останн що роб перед пробудженн — передав молод поетк держзамовленн на всяк так літератур в сні я мудак ал іронічн,1,20
заправил повн бак купл зараз кав і їд в одн дуж крут місц пот фотк закин,0,16
якщ у медіаблядє нем грош то йом нем що робит окр прогляданн телебаченн,1,13
госпідарк прост пристрасн до грош бо ї не потрібн віддав,1,10
дум пор одяг пуховиккол вилаз з ліжк,0,7
двіч мен являл квитк ал лох це дол том за гро одніє несимпатичн команд з інш можн поспостеріг і вдом,1,20
в голос турчин мен час час вчуваєт кучм,0,8
мабут і всі дивит що стрижк « під хлопчик »,0,10
харош вечір спочатк настольн ігр з друзямитвітерян пот скайп з найліпш,0,11
роботижден всьо уііі під пошук пригод на сво радіст пищьпищ,0,10
блядодощ дуж дор кошт ал багат хто одн на ньог грош викид,1,12
світ кав топ туд андр іванович ход,0,7
нов слоган ізраїльськ держав обріза і володарю,0,7
а знаєт хто я канєшн шлюх,1,6
альтерег владік ям то не прост так,0,7
сподів я буд в стан що пожаліт,0,7
в саморідн вже не жарк а через 30хв стан прохолодн,0,10
провел ахуєнн ден відключ всі гаджет ні одн мразот з робот не змогл до мен добр і вкотр виїб мі мозок відчув себ дейенеріс таргарієн як обклал дракон всі хочут спійм ал натоміст сосут ху,1,35
будеш батьк ну хоч хрещен з джанк загавкаєт під час осв,0,11
ну я наївн лох,1,4
баб зна порадит підтрим,0,4
бля кільк тижн дум що переходж дорог по зебр а виявил що я підар і нов зебр дал на пар метр,1,21
див порн так ніб тоб за плат,0,7
в україн стільк не народжуєт 60х рок минул сторічч,0,9
іменн тут і жаліт не в інстаграм ж,0,8
під нос сук під сам нос блят сліп мудак,1,9
а якщ в кінц додав мил смайлик то вигляд миленькоз спав з іншоюз здохнеш підар єбанийз,1,16
мі знайом я раніш себ екстраверт вваж,0,7
цікав момент у фільм і почал гроз ну чорт,0,9
неєбац ще жив повинен вже мертв,1,6
ну всьо норм жи забє і насолоджу дар бог,0,9
мен здаєт що на мі комплект розлад зраз в больнічк треб,0,11
це вже мен підпад під категор напряжн,0,7
нах стільк морок аб лиш напис шо дехт уйобок а дек я хоч трахнутирозчленув,1,14
це позасиріл що посл на місцев дискотек на останн ден літ,1,11
ну останн два дні я їм а до цьог два тижн харчувал вод,0,13
вопш шоб не щіт шо я мудак і туп відсидж дом сам так вваж учор відайт пис гуманітарн проект по допомоз потерпіл,1,22
зат в ньог пуз гарн на одн пуз житт нє построїш,0,11
це пацан біжит на бігов тримаюч рук в кишен,0,9
мудак виїх з рейтарськ на червон йом дуж треб куд 3,1,11
і ще десятк тисяч у ког лох — то покликанн,1,10
не факт що попадет то раз то довол поган то два,0,11
якщ хочеш щоб баб тоб дал то пригост смачн кав с,0,11
ок говорит шо я фальшив холодн і ніхт насправд не зна як я а зач мен це якш рівн кожен мудак буд цим пользув,1,24
твітит з мог акк мудак,1,5
а ну це легк колір мен тільк треб вказ як,0,10
пизду спи поху ї,1,4
так наш куд іт в купальник по хат,0,8
нарешт політичн діалог виходит на рівен е підар сам підар8,1,10
у віїбльостк нем мозк том що всю витратил на накупівл парфум,1,11
що зробит полізутьвідпиздил кол вон заснул на стадіон заснут ще глухіш,1,11
чека ал я цьог всьог тепер голодн,0,7
єгор соболєв зізн в том що лох 10201847374305681 …,1,9
аххуєнн що жінк не можут пит більш одн коктейл а мужчин можут пит скільк завгодн,1,15
перекрутил телефон у всі бок щоб пон що то так,0,10
що дуж бляцтвувал в том людин ал прост жахлив партнерк,1,10
нікол не розуміл люд котр сто в черз в магазин по 12 гривен,0,13
« кожн хвилин в світ народжуєт лох »,1,8
відчутт що не прост стоїш під дощ а стримуєш умієш йог поток жадан,0,13
наїбнув так що йог мам не помігл йом встат,1,9
у мен 11 клас ми як дійшл консенсус,0,8
ва це людин котр гандон тра користув тог щоб теб робит утирок піш наху атвєтіл ху скуштуєт зємлєарєндатор фінал у шукайт робот хуєглот,1,23
у мен бувш слідак мусор і беркут джекпот наху що сам показов найтупіш уйобок якраз беркут,1,16
пизду працюв скотин,1,3
ще кращ а хто лох тип мен,1,7
що так божокпиздобол не ма ніяк гарн вирішенн проблем,1,9
11 одн раз мен не прод сірник мен де 15,0,10
що зробит якщ тво дружин прийобув теб до дом раніш ніж планувал прийобу назад,1,14
якщ далек дом баб з вам,0,6
то момент кол шеремет в нувгп а в теб пар і тоб не сказ,0,14
клас помітил щойн що мо повідомленн проігнорил ну і йди наху,1,11
жінк справжн володарк сердец,0,4
моменткол післ бугівуг починают танцюв лесгінк,0,6
через останн сер взагал як дуж важк сприйнял ту істор,0,10
що деньневийобуватисявтвітер за пригод щоб побачит жінк запізнюют на ранк постільн думк,1,12
мудак я не мудак більшіст перекон в перш,1,8
їб хочет тоб вмаз у скрон,1,6
дзвонит по телефон в нас три хвилин мал я мож і більш тан,0,13
не буд знов до себ занадт самокритичн,0,7
насолоджув момент не розмінююч на дрібниц,0,6
згадув лишег моррісон а як ще мертв поет любит стихійн,0,10
я не запереч що мудак прост це арешт відволік люд тог що наш сбу в реал ніхір не робит,1,19
тактакгарн думкаал там під диван бач ще трох пил,0,9
чит нелепыеситуациитвиттерск і всик зі сміх я виявляєт не один лох що в склян двер вріз,1,16
опівніч сам час розкручув ставит на місц дверн ручк,0,9
лох ет судьб,1,3
тві юп опис мо реакц на що вже 2017,0,9
багат не встиг з тог що муш зат вдом добр і спокійн,0,12
а у теж список фільм як давн збираєт глянут,0,9
влаштувал соб не тюремн розпорядок дня і не наваж йог порушув,0,11
прилет горобец і кинув біл мен шматочок хліб тип трима убог поїж,0,12
нефіг з тоб робит,1,4
поїб на цю красун одруж ліпш з маріє,1,8
калюж глубок ног мокр а я довольн,0,7
що тип йди наху там мир,1,6
мудак і мудак йог не назива с,1,7
підарас всі рядочк соб забр лиш шоб доспів,1,8
а у фільм ще прекрасніш ніж я очікувал,0,8
а ід наху,1,3
бредл купер в рол шефповар аа чекат,0,7
я і не подумал я під час годинн лекц засин цікав,0,11
голожопенк йде по вулиц і видих а де я забул сво босинк,1,12
якщ тво дружин ма охуітєльн особистіст то мабут прост потреб що охуєтєльн,1,12
і тільк в ліжк зрозуміл наскільк втомил,0,7
мудак йдут на вечірк і на не прийшл всі а мудакес залиш дом бояв подразнит хто зі своїх друз,1,19
що робит неатсєрц на літн курорт прост посип люд пляжн піск,1,11
жінк здатн зробит світ кращ місц житт,0,7
доходит до довбал значит вже дуж далек пішл,1,8
я теж ал це відчутт треб дуж сильн приховув священн війн всьо так,0,13
ну не можн з вам викладеш фот з норм падруг зраз всі шлюхашлюх хот бер внатур зі шлюх фота,1,19
безбожн криш печив в ліжк а в мен дружин то я уж отрим на горіх,0,15
ан ніч зараз не пишіт я балув буд буд ласк хвилинк зачекайт,0,12
зна хлопц спеціальн куп мотоцикл з одн сидінн щоб нік не кат,0,12
за своє хуйне див гаразд а побачиш хіб що табличк ід наху,1,12
що за охуєнчик забр носк навіщ приїх на вечірк якщ не мав на що прикрасит сво ног,1,17
січен в каліфорні так радіст на кампус пахн жасмин і мед,0,11
мам говорит знайт друз ок зараз у відділ « друз » нов підвезут,0,13
йде гомосєк і дум що мен поробит щоб заробит денег а так мож я зробл аборт,1,16
госсссспод добр ранк це ж так треб вміт майстерн псув настр,0,11
я сов насправд я їбанут пташк як прост засин дуж пізн і вста дуж ран,1,15
ясновідящяяпрост йобнут на всю голов з неочікуван дивн фінал спойлер всі помирают і за рахунок цьог хорош,1,17
солодк і тепл тоб пс раз не бажаєш то я так побаж,0,12
