text_preprocessed,label,len
вон недавн пробіг тут що не бачил,0,7
що ж найкращ у цьом жидомасон що не мож пройт між ціє двом скал,1,14
хіб йог там наприкінц не зжерл,0,6
інкол так хочет черпнут трох енергі земл ал ліньк знім асфальт,0,11
у львов тих осінн вечір тільк в ког за вікн буйн квітл черемшин,0,13
ал зібр вдіт і вийт за 10 хвилин це рекорд,0,10
тепер я зна хто звідк і до ког куд можн їх в гост,0,13
наср на себ сам,1,4
львів хто мож впис двох чарівн дівчаток,0,7
глуп що перейоб не зміг зробит,1,6
жіноцтв сприя досягненн гендерн рівност,0,5
не подобаєт ім моє знайом том назив лін меніможнавс,0,9
поприходил сповіщенн на змін парол в телегр мен намагают злам,0,10
очередн раз упевнил що я лох по жизн ще не ні одн дня щоб я не влізл в як жоп,1,20
проголосув ал на дільниц дуж мал люд не лінуйт проголосуйт вибори2012,0,11
в мен сьогодн стійк відчутт і непереборн бажанн вихідн дня,0,10
от лох приїжджа на борщ,1,5
тво мам так глуп що перденден виходит з не інтелектуальн пізнаван,1,11
що працю говновоз ган ганьб,1,5
вже традиц післ кожн наш івент чит приємн відгук,0,9
алл це штаб навальн тааак а пошепк я на математиц,0,10
лоханеш маєш вдячн що тво родич не виявил теб на вулиц,1,11
ми вже з уч нашуткув з цьог привод в мен ще козир один гіг,0,14
ну так шо ж радиш якщ на парафі порожняк,0,9
що я поглинул глибок роздум і так схвильован що не мож з них вийт,0,14
згівнял до своїх друз слон до стін відчув потреб ал не міг ніч зробит,1,14
о мен кол сказ що так мож тільк стар шлюхаалкашк говорит мен нагадал оц що я любл люд,1,18
кол вкалув скотин мріяв вільн час і відпочинок тепер же кол і час і відпочинок я не зна куд себ припх проблем білиз людей блят,1,25
я відчув себ безпечн під опік бабус,0,7
наааахуєш ал житт не да тоб шанс на усп,1,9
йобайоб не потрібн виходит на вулиц бо там занадт багат здоров,1,11
і взагал треб вимогливіш до тог що суєш соб в голов,0,11
приїд в україн буд всюд підслуховув,0,6
взагал перестал розуміт що вдяг на вулиц в цю погод,0,10
літр мятн ча сам що треб в ці ситуаці,0,9
афігєвшш що держ на себ в пошук партнер то це прост примарн жінк,1,13
якб не зелен квітуч дерев то можн подум що зараз осін,0,11
що буд якщ офігієш протяг дня більш ніж працюєш тод замінит тоб потрібн буд себ,1,15
то надт давн а турк українк не ідентифікуют,0,8
ми плануєм в че мож спробув в рук відд пошт швидш,0,11
нах піш мудак кніжн,1,4
ще якщ не вдом це ден найкращ за всю цю весн,0,11
ідіт наху з своїм куліч бляд,1,6
не мож зрозумітиц ранок добр ні,0,6
то ще вованад з довг волосс не бачил,0,8
так хочет спат що якщ позіхн в повн сил то повтор сцен з дзеркал,0,14
що робит бляяяяяяяяяя в бібліотец заходит на сайт доросл,1,9
єсл в дєтств не біг нарут вважа лох проєб що будувал сезон,1,12
ход потрах до психіатр так що треб потрах,1,8
якш колинебуд вимовлял йог ім всу шлюх,1,7
шо здаєт мен що завтр і післязавтр буд ходит з заплетен волосс,0,12
люд перестанут пис вийняток і мабуд кол нікол,0,8
чорт оц завтик забув удом переклад зовс,0,7
глян лян пост на фб наприклад там лінк на ту презентац,0,11
ніхрін не можеш приємн провест час з своє сімє прост занадт гадк,1,12
прийшл мам відкрил вин за секунд я лох,1,8
залізл на робоч стіл не знал що тут так зручн сидіт,0,11
а якщ я мал на уваз не дум так всі не і я не,0,14
я тан вдох олег піш наху видох,1,7
я вже так не мож два рок лох – треб термінов монетизовув медіакомікс,1,13
що ма зробит жидівк щоб діст до кінц дорог заплатит проїзд,1,11
дорог братт і сестр а в мен одн в це передсвятков час не працю сайхаб,0,15
нєвїбєнн що ці жінк мают багат друз так вон гот платит за їхн люб,1,14
мо тоб порад нікол не втруча в чуж стосунк,0,9
3 на мен не змит макіяж вноч зранк вигляд працьовит нічн шльондр,1,12
сорьк на так кількіст костюм ще не виросл,0,8
так мил йобнут що слов не перед тюю,1,8
бер ножиційд відріз ком язичок,0,5
що мен примирю з дійсніст я сам частеньк веласьвед мудак,1,10
0 хат шо це я лох мож інгліш ог а не я і без саб зможеш тод окрем респект за розумінн британськ акцент,1,23
баб ма неперевершен вплив на своїх внук,0,7
хочет випит розчинник і розчинит в мороц вулиц,0,8
порадит йом дійсн гарн порн аб сформув естетичн смак правильн в дитин,0,12
прут ті люд як репост стат тип забер соб на стін і будут в теб грош пизду на робот ідіот працю,1,21
в хвилин а обсяг безкінечн аб витрим,0,7
сук ахуєнн прост блят ахуєнн,0,5
тсс палиш нас а взагал я рідк їл зїхал но фан їст сам,0,13
а якш справд байдуж то не перейматимеш,0,7
випіздил жінк з авт виявил що бездомн так що не поспішайт дивит на бездомн з поган ок,1,17
що жопут люд найкращ зробит з жоп помін на нов,1,10
я стар що інш написатиал не хоч відправл,0,8
гарн мандрівк якщ рапт у риз тре що показ пи я тут з радіст допомож,0,15
хто лох і куп дружин гаджет вінд в як не можн помін мов то я не очікув що так лаж в принцип можлив,1,23
де я в цьом житт не ту лінк клікнул бо приход запрошенн на ботокспат,0,14
треб термінов завест нов колишн щоб ще одн людин розчарувал в мен,0,12
я більш по чорногор і гогран ход на боржав вперш буд,0,11
і всещ я мож сказ їб я лох,1,8
вперш в цьом дом кіт прийш і сам сів до мен до своїх так рідк сід,0,16
відпердол тво житт і відпердол тво мам,1,7
смірн з сірожд так переконлив у свом стьоб що прокремлівськ шльондр агап пов гг юмор зза порєбріка46,1,17
секс секс їж обож так штук за безкоштовн ірон в кожн слов,0,12
що походит на жінк і ма шест ног походжен стіл,1,10
найпрекрасніш в історі — спостеріг за тим люд недооцінюют своїх опонент,0,11
то шкло і лох,1,4
пизду пром ран зал перекисс і буд обережн буд ласк,1,10
наїбен це приємніш якб мертв,1,5
хочет шо кинут у парочк котр ніж на вулиц том що ідіт наху о чом,1,15
тво мам так бляяяяяять дурн що даж в преїзд не пройшл,1,11
в тест варіант пред разным излишеств це завуальован бух оок,0,10
дівчин не відступ своїх принцип,0,5
що за гандоніщ придум теб прийш до робот в пятниц без своє гандоніщ,1,13
вип не закур мабут всетак кинув,0,6
якщ достатн дурн щоб зробит пердячок можеш зробит друг пердячок,1,10
крюк в своїх перш сері ще прекрасніш ніж дал,0,9
хто взагал так щоб указув в чом ходит,0,8
зим не да вдяг шлюх,1,5
трох бух гот ретвітит допомаг зі вписк,0,7
що дум лєнкан жінок що вон повинн працюв більш щоб мат можливіст забезпечит своїх друз і діт,1,17
йопнув сво правил так і буд дефіцит гідност,1,8
встиг всевс непотрібн зберіг соб мантр,0,6
а ще ця скотин мог антон бач ну бляя пач нє я,1,12
а чо сумн я дуж весел ал їбанут малєньк,1,9
варт на жал хоч ус кажут що незріл мудак тип тог,1,11
я так ходил і то один з найкращ концет в моєм житт,0,12
дід мороз спит хочеш мам так мам,0,7
ауєнн людин це так самостійн істот як зна що робит ал нікол не робит що потрібн,1,16
ще трох і напиш в твітер філософськ трактат під назв мен встав через 3 годин аб я мудак і ніяк з цим борот,1,23
настільк хочет прост зникнут і поїх куд далек,0,8
в мен не вихідн я на робот в неділ відчу мі біл,0,12
блядок поч виношув у бар ал близьк заблук блядок,1,9
мо вчорашн мудріст продовжуют ретвітит і сьогодн,0,7
виєбаєш задовг,1,2
якщ данунах не мож правильн пис це прост дивн,1,9
жарт я викупил сподів ал ні це колишн не мудак том ображ мож лиш я,1,15
тво мат так офігезн що при перегляд настр змінюєт на гарн,1,11
чоррт спат треб завтр чорт практик зраненьк,0,7
насправд на зйомк приїх до клієнт фільмуєм процес будівництв,0,9
а хто взагал наху пизду звід,1,6
ще не виріс то хміл з як звар тво пив,0,10
ідеологічн лів політичн насильств в біполярн світ це мен перш юнацьк люб чудов знаєш що мудак ал рок не можеш припинит ньог дум і бачит сни,1,26
бабкін людин ренесанс і жнец і швец і на дуд ха йом грец,0,13
на що витрачают музосранськ грош на пив і гавн,1,9
що робит гаслагімн в антикаф пацюк поряд інш засмічен людьм,1,10
приход потрогаєш і булочк теж с,0,6
канонічн русняв хуєсос вигляд сам так • нужн разобрацц кто напал • трєбуйт ат власт штобл ід наху підор2655,1,19
навчіт мен хто чистит мандаринк бо я ж лох як порск в оч сок арх карм,1,16
що пердачч говор друг друг кол вон зустрічают привіт пердачч,1,10
йобнут вечірн транспорт ууууу бля,1,5
що робит пиздотн без дом ходит на дискотек,1,8
сам прост в профіл харизматичніш вийш,0,6
львів батьк як любиш вже том що існ с дан,0,10
а я лох вірил що не курит бо обіцяв,1,9
я ні ал останн час мож їст хавк з ним,0,10
що зробиш якщ дрочиш занадт довг вийдеш з електричн шок,1,10
дочек микол під спат сьогодн змучил,0,6
оцінюйт люд комплексн а не по одн твіт бо тод виходит що я прост мудак хрінов пиш,1,17
нарешт рис лапш довг не в магаз,0,7
під фільм рекомендуєт лікув грип,0,5
відхуяр йог за що не вмі говорит поукраїнськ,1,8
це ж тип зараз — найкращ рок мог житт мо найкращ рок,0,12
якщ теб дуж цікавит житт оточуюч і прагнеш в курс подробиц спробу пошук відповід на животрепетн питанн в книз ід наху теб це не стосуєт,1,25
нху мам перед пап а пап йом говорит не діла нху,1,11
кожн раз кол мен пишут кажут мен пох хочет сказ ну то пизду ліс і мен не чіпа раз тоб так пох,1,22
всмисл я теб не додавал шо певн що перш,0,9
я лох пор мін назв в тві з тинк на лох,1,11
спочатк їбанут мудак відчеп вже а пот сонечкокотик класика916162371453947906 …,1,10
кол варенн отот вибухн то не до лагідност,0,8
шук людин як буд мен фотк а я любит можн по черз,0,12
сум перш трьох цифер ма сум наступн трьох,0,8
хотіл реплаїт і випадков лайкнул знайшл соб подругугітлер,0,8
якб доїб то баб не захотіл з тоб дружит,1,9
всі блят ниют через ті спойлер ідіт наху піздєц проблем,1,10
в голов вже напекл майт на уваз якщ буд пис брєд в мен сонячн удар,0,15
дохєр нероблив що йог власн мат не хотіл йог прийн,1,10
філфак чудов спосіб розчарув в соб,0,6
ця маленьк радіст кол зарядил телефон у провідник ні радіст велик,0,11
чувакяк пиш меен в 5 ранкут хот панімаєш шо робиш,0,10
кол побачиш цуцен у річц буд ласк не скурвлю йог,1,10
чом баб думают щоб вигляд сексуальн це одяг шльондр,1,9
чілавєк заніт я де зна кол вільн,0,7
а картіночк з твіттор з всяк там профайл хто зберіг на сєкундачьк,0,12
я лох,1,2
спочатк щоб теб полюбил буд соб а тод як їбанут знайд соб дівк попрощ,1,14
що діл охігєт післ зустріч з друг пост на колін просит прощенн,1,12
що драч на мо кішц встав комар,1,7
кол я в школ то мен ще не куд постит фотк такш норм,0,13
аїуєнн почуваєш кол прогаляєш ціл ден під карантин,1,8
мертв півен в навушник розбуд аж,0,6
хмдивн буд 1 вересн детал тоб точн скор мают повідомит тві студкуратор,0,12
зна сам по наплічник що модел не зайшл а сумк їхн нош з радіст,0,14
що мразюк найкращ знают підн настр навкол близьк до нул,1,10
забагат сторіз в інстаграм я втомлю дивит,0,7
мен ще сподоб то з твог тред шо повернув хвалит навч ще ефективн принижув фінансов залежн ньог баб тим слов що нас вивч прям еталонн мудак,1,26
нагріл лед не до втрат свідомост,0,6
новин як ми заслуговуєм а ще я заздр бо теж хоч пюрешк з катлєтк,0,14
якщ пздієт так швидк потрібн прийн препар прот алергі,1,9
100 як мудак що набаж,1,5
не мудак я сказал а узагальненн не любл взагал,1,9
це щоб ті пятер що відпис зрозуміл що втратил,0,9
і правд шо лох васа3,1,5
сьогодн сміл мож сказ бегбедер з йог любовьживьоттрігод шо лох і ніудачнік,1,12
тво ж мат я знов впал ну звідк ті ног ростут звідк,0,12
що зробит кол тво подруг взїбнул з тоб ніч страшн прост пошука нов,1,13
я це соб збереж в телефон іб прекрасн,0,8
і знов цвіркун на ляворк юлян що з твоїм волосс взял в команд підлітк титан треб дотримув канон мін єдин любит відсилк на робот жарт не зрозуміл їбанут плю добр що не вкурс що за канон син артавтор,1,38
мен у небезпек навпак демотив і я забив болт і каж премі,0,12
дивл в монітор і засин сьогодн ніяк ефективност,0,8
післ холодн душ один маленькиймінус ал имчасов і справд маленьк,0,10
ранок ні в чом не винен винен уйобок шо вчасн не можеш лягт,1,13
дівчин модел впливал на творчіст художник,0,6
так рідк дивл шо що як фіолетов кол не подобал одр тот греб і я обходил амел за гараж а пот глянул і зрозуміл шо я лох,1,27
люб мен уйобок інакш я пущ тоб кров виріж леген видер хребет,1,12
я зрозумілащ блогспот початківц простіш і зручніше справд в цьом лох лох 8 а пис так хочетьсяб ма що сказ,1,20
чим дал роздупля в том щит не лох в ексел тим більш мен то нравиц бо дан формул результат пощітан і всьо вапр єст вапрос нєт а якш і то не до теб це не то шо в дізігн сін нєдостаточн сін а круг недостаточн кругл,1,46
а хіб можн відмовл яких урок отак прост по заяв,0,10
не чит параграф і ціл урок сидіт говорит з вчительк це параграф із,0,13
найцікавіш книжк я чит в туалет © умберт ек,0,9
чом я сьогодн вирішил що буд тепл,0,7
то чом ще не спиш то ж перш заповід болит гол пизду спат,1,13
вознаїбн цих хто не згоден з тим що жінк мают доступ до тих ж ресурс і чоловік,1,17
кожн дівчин що там кожн людин мрі прост людськ здохнут,0,10
загал перемальовувалс малювал розбирал що то значит,0,7
шотот лох ет судьб дос ржу з цьог 96639446798814412919 …,1,10
а поліклінік тепер то слоган хвашизм нікол знов,0,8
нє мудак я а з тисячниц вліжк рідкоз,1,8
намікаєш знов на що в луцьк мен прощ ніж на позняк,0,11
бляя маєш більш пробл ніж красив друз,1,7
в як період житт мен поч бісит нитік виріс,0,9
ус привіт шо ж так ніч не хочет,0,8
що зробил ацеякасьхуйн кол почул що прийшл зим намагал захов в сво шапц,1,13
ладн серйозн зараз кожен сран мудак ма сво точк зоруцінув треб люд як можут діст наркотик,1,16
якщ ніфіг не знаєш то прост залиша в сво лазн,1,10
сидж і дум я ще не отравил тих реставраційн смород,0,10
настільк глуп що даж гомосєчк більш ніж не зна,1,9
я мож продовжув з дуж багатьм рейтинг і майнд ю тих де україн обскач як залуп дуж мал мі пойнт дум зрозуміл якщ не влаштов безвіз з уругав ал катаєт в єс сша і канад то ідіт наху о що я мож сказ,1,43
у мен костюм під колір волос а сорочк під колір шкір,0,11
нагодув домашн котлет мняс українц українц,0,6
в повсякденн житт жінк зазвича стают жертв сексистськ поведінк,0,9
що правд так вкурвил йог на вихідн прост хот їст погарн,1,11
ну знаєш до фот уявлял анорексичк з кар менш 163,0,10
атєб посадил в місцев адміністрац том що дуж добр вмів продав безсмислиц,1,12
будут набир команд локалізаці маякніт вибачт ваш вод мудак,1,9
у мен з туп російськ тролямишовініст розм коротк в спам ïх і,0,12
більш ідіотизм тоб не усн,1,5
я вчор не пил а поводил себ пян,0,8
в раз небезпек вирв шнур видавит скло зірв будильник,0,9
ахуенн що люд з далек восток не вміют говорит поанглійськ,1,10
94 я ше кол в твітер коноплянц писал а не відпов мудак,1,12
тут мал сторіс як так люб джанк ал нє,0,9
люмпенот тут не відбирают не діл піш наху,1,8
оп ше взагал ніч не дивил ал раз так діл то ща глян,0,13
наср на хто дум що українськ мов не потрібн,1,9
жінк мают так велик здатніст любит люб,0,7
а нащ замазув йог ім якщ в твоїх коментар,0,9
не думал що йог хто зна я сам йог вже рок 34 не вмикал,0,14
мен здаєт що слов заслугов на місц в рідн мов уйобок шо знов наджуйсер дуж органічн нє,1,17
з ‘ їл піц образил шлунок повернул до курк з гречк,0,11
що діл жінк кол муж приходит дод пян йог отпиздячит,1,10
парасол ніх не помаг дощовик тип не буд йти лох в кульк том,1,13
згаял півгодин на пар щоб заплест рибяч хвіст втика на пар з корист,0,13
