text_preprocessed,label,len
що робит жиробас післ завтрак піш прогул щоб знайт ще більш жир,1,12
тепер можн спокійн дум 6те лют,0,6
що надаєт дівчин як приїхал до дом подовбл ніч ж вже подовбл,1,12
жінк дуж добросердечн гот допомогт людин в потреб,0,8
так холодн нач в мен кров рідк азот,0,8
підтяжк герман роб лікарпатріот геро слав,0,6
так і запишем дружн тролінг не розум,0,7
нем ніч гірш за недоглянут нігт незакрит гештальт,0,8
кол вже в айфон буд зберіг що нафатк у снах,0,10
гендерн стереотипн модел навязан патріархальн суспільств,0,6
хто не пян то лох хто пян то ендр,1,9
що зробил пздцкрчка кол почал пит започал ближч до дівчат,1,10
мож данилк руслан бо шо не сходит,0,7
у люд виріш харизм в кулінарі спеці,0,7
їб же наївн дурник,1,4
уг бо в мен десятк а в лучч падружан вісімк і ми так порівнял і з ‘ ясув шо я лох,1,21
я теж лиш де о 193045 змож у центр,0,9
запросил чувак гул чекайт скрін то шо в ньог мал з підпис хто лох как абична3,1,16
тільк поїхал у відпустк а тут змін по єсв нє ну це треб так бігт,0,15
навіщ охйоптв дівчат потрібн працюв якщ їм можн прост зайн охйоптв,1,11
ласт не перемика на російськ дяк,0,6
смачн червон сицилійськ вин гарн завершенн дня,0,7
хвилин з 20 бав пошуков смо як розпізн слов і перетворю в текст,0,13
настр між зар на як вписк з куп бухл і ідіт наху я спат,1,14
виламу дверівідрубу голов і пісьььььь,0,5
а пот « ти ревнуєш бо в теб самооцінк низьк » йдіт наху,1,13
що жопіньк найкращ зна правильн грат в покер,1,8
ніч так прост твіт присвячен дню кол я списувал найбільш,0,10
на готельноресторанн справ поступат,0,4
що мухропенд якщ мухропенд президент всі раділ що дав всім грош ал не ніяк правил,1,15
ті шо з крапочк помалюв а стерт фарб не бер хіб цибулинн но не факт,0,15
що найбільш смішн в цьом міст що всі жопудайк тут хочут поцікавит,1,12
якщ у теб надт багат грош то міхопиздобол,1,8
ні до 21 числ 1800 вже перевірялас,0,7
я тільк не мож зрозуміт то уйобок давайт будем насив реч своїм імен до сотн дійш чом ніхт раніш не поміт,1,21
брехунец дожив сво дні останн справд українськ,0,7
а в невміл можн потрощит навкол і себ поранит,0,9
у мудозвон два друз – християнин і мусульманин поспілкув і побаж один одн всьог найкращ а пот християнин сказ зна що я вір що мудозвон прав,1,26
чорн рис на вигляд мишач какашк а пахн бражк,0,9
придумал нарешт відповід на дуж смілив дівчин каж сор нє я їбанут,1,12
дівчат навч готув яст шефкухар,0,5
ром польот ніб нормальн палкін ніб улибаєт,0,7
що робит гівняшк в бібліотец прост байдуж глядит на книжк якщ йом неч робит,1,14
вперш за недавн період захотіл сходит в кінотеатр там фільм хакер,0,11
ха зараз буд а дал подивим,0,6
наїбніт прост пішл до церкв щоб дізн де знаходит ваш мудріст,1,11
бо наш це земл їм всім назл не вмерл гонгадз,0,10
прокид о сьом а я ще не засинал жит це житт,0,11
забул парол робоч мейл тепер писат секретар шоб відновил лох,1,10
треб йти збир кольор листочк а то почнут дощ,0,9
арнув з бухгалтєр яр доказув шо бугалтєр мож ще економіст і фінансист а економіст тільк економіст лохєт судьб,1,18
ахігезн українец прост дуж легк посміхнут прост дивит на сво банківськ рахунк,1,12
що зробит якщ тво дружин бздит залиш мен забут,1,9
капєц мудак,1,2
відшкоду сво пердач бо інакш навік залишиш бездільник,1,8
не макдак окрем юридичн особ з одн фуллтайм співробітник,0,9
дуж падєбільн виглядаєш,1,3
що більш говнарськ поступк закоханн заміжн,1,6
уж мабут післ великодн вибер до,0,6
треб приїх на чайочок буд перш раз кол я не набух,0,11
кохайт чорнобр не з москал,0,5
нєхуйствєнн це кол кухар нагот правильн а господарк одн викр їдальн по плох,1,13
ахахаах уяв що буд якщ ще заговорит до мен я ж фанатк закончєн,0,13
віж сам чоколядк прост багат,0,5
чувак прост гавновуз не маєш ніч кращ робот,1,8
– ким хочеш стат синк підростеш – льотчик космонавт – ні я буд антикурвапціваньєр сірож лєщєнк што я лох какойт,1,20
дзвонит саш пит як план на вечір саш шо безсмєртн,0,10
маштабн мрі ал побудув вигідніш,0,5
творчіст дівчин відображ відчутт емоці,0,5
жіночк ма талант відчув себ відповідальн в будьяк ситуаці,0,9
відкр сторінк і шльондр з як трах колишн полайк всі фотк,1,11
ми це вже давн знал нащ факт щас говориш,0,9
мают завтр нач вже дат бухгалтер вже декільк годин чек сум не вистач,0,13
якщ випєндрьожн то не потрібн працюв ваш батьк підтримают,1,9
гет замарстинівсьок до варшавськ ал шо за мост,0,8
я одн не розум хуєсос наху повернув ж себ виріш тіка наху малорос там маларос як дают в жоп за рубл любл не довг і зїб на хайп зневаг не даст ніч туп когут родін сьінок там гдє жоп в тепл мразот,1,42
ідіт наху шутнічьк,1,3
шо праісходіт чом на лукянівц так багат студік в субот,0,10
ну що здавал слова ці словац три слов,0,8
уточню до чорнорожев ліфчик на гілляц,0,6
в один ден шо реальн станет а всі забют болт,0,10
мен вже не горит я прост ржу з ідіотизм,0,9
хоч чог солоденьк аб в крайн випадк теб,0,8
виходит одногрупник і каж до січн ах ясн панятн не одн я лох,1,13
а всім подобаєт пс я зна що дивил,0,8
і гіперпосиланн з вік крив машинн переклад з москальськ,0,9
лох по жизн лох ет судьб тіпічн я,1,8
якщ відпиздієш то мабут більш ніж прост глуп,1,8
а я ладочк і я прост лучш всєх так що 11,0,11
йобнут кле надих як ще кле кол кол склеюв розбит серц,1,11
недойоб подав до дівчин представля соб не сам приємн зап,1,10
лєн прибрал в кімнат тепер в нас не у конюшн,0,10
що зробит якщ у теб появ обсцик прост підубива йог,1,10
і ті хто пост люл діл на 2 тип,0,9
обісцяв йде до таверн а по дороз застряг на вулиц і кричит хто з перш до бармен,1,17
мен любиш нє знач я точн не мудак бо у теб вкус на мудак,1,14
вирішил подивит щоденник памят бо тиждівчин,0,6
нямкаєт а я сам соб от поставил запалил сидж рид де в душ,0,13
якщ висучніст то ваш мам ма худ просит допомог,1,9
розтуля губ граційн нагин ніжн шепоч тоб над вушк ід наху мраз,1,12
головн не спалит рис і не забут сходит в душ,0,10
що делаєт з говнофот продаєт на аукціон,1,7
пришил шлейк до рюкзакавідчув гордіст,0,5
ну з вікн потяг ліхтарик я ще не світил шкод що марн,0,12
і творчєск лічност я сказал філолог такшоо,0,7
дуж важн вопрос скільк алкогол можн провезт з німеччин міцн і неміцн,0,12
що я хвилю за голодувальник під укрд,0,7
дівчинк займают спільн робот,0,4
сьогодн ніч на підлоз добр всім ноч,0,7
жінк дуж розумн вміл в менеджмент організаці,0,7
що пропал педошівц у ліс ідеальн маскарадн костюмівк,1,8
я присвятил тоб пісн ал не вмі грат намалювал портрет ал не ма до тог хист написал вірш ал ід наху коротш,1,22
поперед кол мен не їх в тернопіл,0,7
всім привіт у мен найгірш ранок за декільк днодн а у поч ден,0,13
якщ у хостел не подобаєт якіст постелін соромт просит замін ціл ймовірн що на ні валявсясп як мудак,1,18
потрох почин зраджув деяк думк і не зна це поган добр,0,11
ну тод в мен закінчил аргумент ал підтверджув що сволот мудак і мразот я не буд,1,16
що кажут педосівчанин кол вон залежн алкогол потрібн педосівчанин,1,9
уходіш ну і пизду,1,4
на вокзал прям пів поверх якщ дощ не буд можем прогул,0,11
дівчатк в школ вчат у різн клас,0,7
що робит гавніц в бібліотец вон прост ліж там і ніч не читают,1,13
дофіг люд потрібн закинут до мор,1,6
шол знов за правосєк голосув увікнул опаленн,0,7
я пропустил момент кол лох поч розшифровув щасливчик,1,8
йобнут а не хвор,1,4
на що поїботин не мают доступ до інтернет на що вон занадт глуп щоб знат йог включит,1,17
ця книг цкур тадзак дуж достойн радж,0,7
рожден підар 4,1,3
дивл « слідств вдет екстрасен » і рев ну наш я то дивл,0,13
настільк непиздіт що відсутніст мозк не мож теб зробит менш гадк,1,11
йобб так глуп що даж не знал правильн пис сво ім,1,11
а якщ перш твіт як бот це ретвіт мог репл соб ж то це успєх,0,15
що зробит дівчин якщ ї скажут що зафігачил почн плак набагат гірш ніж кол зафігачил,1,15
що наїбен прийш у цю кімнат і поч надруг над жінк,1,11
тварин подив тепер хоч загляд в безодн,0,7
у жінк велик кількіст друз знайом том що так добр,0,10
вчор транп вєріл путєн сьогодн транп вєріт спєцслужб сша же огидн мудак ж так рулит нараз штат,1,17
а том що уйобок ніхт нікол не винен крім теб запорюєш,1,11
що за хвороб гівнокодінг тільк підор знают лікуванн,1,8
що зйобуют жінк зробит з цим мужчин закинут йог в мор,1,11
новасосос найкращ спосіб залишит ваш супруг без слів,1,8
бер в рук бібл я на ніч гляд чит бібл будеш ж я шо йобнут,1,15
ахуєвал рапт потрапил до психушк,1,5
сук то ж зі всіє баз потрібн вибр пар питан котр я не зна і засунут мен в білет взагал не лох,1,22
можлив встигн сьогодн в душ ког я обманююможлив цьог тижн,0,10
от помр і будеш шкодув шо так мен кажеш,0,9
впщт я пухнастіньк єнотік с я тільк граб і гвалтуюз,0,10
у жінок так маг як вон віддают своїм діт домашн колектив,0,11
в мен як сам маленьк наплічник я компліксір,0,8
вден усвідомлюєш що дурен а вноч що повн мудак,1,9
блін хотіл ког відписацц погортал подивил а всі так кот ідіт наху,1,12
зожхуйож дурен,1,2
жіноч працевлаштуванн одн з елемент гендерн рівност,0,7
я вже і так наркоман кагб пофіг на чім сидж,0,10
тайськ шлюх на мінімалк,1,4
так канторк ще оренд юрадрес поштов лист,0,7
справжн мазохіст малюют тортик і крєндєл з родзинк у 2338,0,10
всі пішл і залишил мен куп немит посуд,0,8
ця істот і у твітор так ж ватн їбанут з претензіє на гєроїн котр тоб позичил на ден а рік не віддаєш,1,22
можлив в мен за ден ніхт не відпис,0,8
якщ виябляєш своїх друз то не зможеш найт хорош робот,1,10
боог це вже скільк рок я не доїхал до теребовл,0,10
тво мам так найафігєнніш що без прическ вигляд дивн,1,9
мен кака гріночок і абнімашек ну кака соб пригот,0,9
доповідаїм українцьк народов педос вже всьо попідкрутян прикрут,0,8
их люд я справжн лох захворіл ну ніч я на месник хоч під капельнице попр що дарм з 2012 чекал,1,20
що зробит якщ у теб виєбудн характер прост при себ так як виєбудн,1,13
щод розправ влаштуєм самосуд уйобк,1,5
оо то не я одн думал що 7 останн,0,9
ніхт не турбуєт мо йобан душ бо всі знают що цинічн скотин а ну в принцип так і,1,18
а я їбанут так,1,4
серйозн асоціюєш мен з рожев пухнастис клубк,0,7
заїбошил і виїхал далек свог родинн міст тод залиша там,1,10
що робит офігєт під час пранн рук охоплюєт пахненн забрудненн,1,10
буд знат що до теб модн буд придр,0,8
що за гімнюк буд в дім немовлят якщ у них нем рук вон будут грат в гру на гаряч плит,1,20
бо я лох і криворук,1,5
ну а вдруг виживеш в кінц тоб ж зараз тог не знат,0,12
три варіант проведенн вікенд ал що час заваж визначит,0,9
напис твіт помилк біг видаля пок жоден грамотн мудак не побач,1,11
це ж найбільш в світ тризуб з лаваш можн буд зробит,0,11
у вихідн а я лох як ма встав з сам ранн,1,11
у сусід уж вчетверт на повтор лун пісн що там блят за скотин соб самооцінк підійм,1,16
сказ що я німфоманк а вчоращ гот мам,0,8
а туман справд магічн спроб зафотк,0,6
нафігатор це прост не прийнятн,1,5
настільк безвізхуїзн що морськ свин пристосован до житт в вод,1,10
подроч сво житт ал йог не почул не зачул,1,9
я не мож ніч робит бо мен жаааарк,0,8
я навмисн на вулиц прост сиділ зарад прохолод,0,8
сказ що залежит галуз мен загал важк уявит в нормальн відкрит суспільств ніш де трим мудак на керівн посад ладн я нуошн єдинорожик ал ж он скік нас в плю записал,1,31
дівчин присутн на урок,0,4
шо я засиділ буд завтр валян по сніг,0,8
бо відсотков неправ частіш чоловік сувор статистик,0,7
і пок тут декстер хаус і бігбенгзіор мовит я тільк що додивил друз ну лох ал ж нарешт і повніст,1,20
ми обійнял перед страт перепрош перед старт літвівторок ю,0,9
я стар ок і нік не ображ стан на щас я нікчемн уйобок не робит ніх більш крім ображ близьк люд сук ху зна там нормальн живет,1,27
ідіт наху зі своїм сніг раз напис і вистачит,1,9
крут смієм всіє редакціє побач поширенн в ког на фейсбуц,0,10
відібр і поділит а діл напиздит побільш на карман а що алігарх бачил скільк крадут мразот йобан,1,17
якщ найпіздєцовіш з нас то потрібн поїх до психіатр,1,9
тяжк жит в світ з людьм важк на підй,0,9
дяк всесвіт що друз розуміют мо пошл жарт і не засуджуют мен,0,12
якщ всюстрануєш по україн то можн почут лиш одн мов голос хабарник,1,12
покр ху стар курв в маршрутц чмо не ма вік і стат чмо чмо,1,14
вибач екзамен в субот останн том дал над буд більш час,0,11
ще помітил що на фот сотн чом перш бач сольчаник,0,10
уйдіт куд зі своїм стереотип буд ласк,0,7
оліксандр шо лох дур фоловит хат хто каз я он продукт йог діяльност корист,1,14
вапш я завтр на ранков йог підписал на піввосьм зустріл називаєт наташк їбанут,1,13
проспал 13 з половин годин що значит втомил,0,8
це настільк прекрасн вечір що я не мож заснут вражен і спогад,0,12
нарешт оператор пішл можн нормальн поїст,0,6
можлив організатор ярмарк варт мат чергов еквакуатор в актив,0,9
попіздил до батьк щоб попросит грош ал повернул з пуст рук,1,11
дівчин образ природ відом у мистецтв передн середньовічч,0,8
ніч темряв тиш і мі шепіт йди наху до комар шо пролет повз,1,13
скорист остан можливіст доступ до інетунов пост,0,7
мен постійн у вух двенит до друг октав,0,8
підпалюв сусід пятк пок це чмо спит в обнімк з телефон ахуєнн,1,12
ем ну це мі твіттер тип щоденник пиш шо вваж за потрібн тип,0,13
що зробит якщ вздрочиш протяг повн годин найкращ прост прийн що бідн,1,12
ід наху я хоч люб,1,5
що варт робит кол нєєб завис не панікув прост перезавантажит жінк,1,11
ніхуяшеяк живут дуж довг ал наступн раз кол побачиш одн це буд на похорон,1,14
ахрінєн так і залишаєт правд що жінк не вміют правильн водит автомобіл,1,12
мен тут кажут запис у як фольклорн гурток,0,8
а у нас ніхт не молит молитв в сім поход лиш я зна,0,13
я їбанут згадал що випил таблетк котр не можн поєднув з алкогол і тепер сук див бол ясн,1,18
тичин заповід катр красив і корисн,0,6
поход це поясню ситуац наш андр великого0,0,7
может ракет засунут соб в дуп,1,6
пишеш кавер леттер думаєш я охуєнн а пот відсилаєш і одраз настр оц я лох тог не вмі тог не зна тог не ма,1,24
настільк афігєв що тво батьк не хочут з тоб,1,9
нарешт сьогодн під в басейн бо вже ціл вічніст там не,0,11
якщ не вмієш посцит то можеш прост прийт до мен і позахистит цьог,1,13
нахрін йог мат зарад не померл,1,6
так смішн ладн шо адекватн придумаєм ког я обманю,0,9
ойблятьцібаб не мают ніяк сенс в житт том що вон не можут ніч зробит добр,1,15
найобудьш спосіб приготув тушк це поставит на плав і дат ї плав до найобудьн,1,14
13 а заїб не спат мудак 3,1,7
чоррт 5 фільм і всі 5 мают сумнимипресумн челендж ексептед,0,10
мцветаев присвятил вірш мне нравит чоловік своє сестр,0,8
поуєбанськ що даж в сам поуєбан дір не приймут теб,1,10
француз за кордон поширю в світ сво мов і культур німец за кордон поширю порядок і німецьк організованіст українец за кордон зрадник запроданец і підарас розбазарю українськ культурн надбанн досягненн і чорноз,1,32
це дуж спонтанн поїздк мен сам,0,6
так глуп що не зміг перехуярит мух,1,7
нікол не думал що мен так важк стрим конфлікт,0,9
вон обявил припиненн діяльност можлив тимчасов,0,6
це не я мен не комфортн я намаг зробит аб повернут себ ал прот мен хотіл витратит сильн і найн тренер на місяц і що оч сказ йди наху всі грош пішл на них ще вправ не можн займ дос,1,40
